=== File Analysis Processing Log ===
Start Time: 2025-10-08 19:05:33
Analysis Type: Cargo_BL
Language: en
File Count: 24
Custom Prompt: No

File Preparation: DUM-PAR-01.pdf (446819 bytes)
File Preparation: DUM-PAR-02.pdf (455510 bytes)
File Preparation: DUM-PAR-03.pdf (463161 bytes)
File Preparation: DUM-PAR-07.pdf (451270 bytes)
File Preparation: DUM-PAR-08.pdf (480078 bytes)
File Preparation: DUM-PAR-09.pdf (486893 bytes)
File Preparation: DUM-PAR-10.pdf (498668 bytes)
File Preparation: DUM-PAR-11.pdf (473492 bytes)
File Preparation: DUM-PAR-12.pdf (455205 bytes)
File Preparation: DUM-PAR-13.pdf (479730 bytes)
File Preparation: DUM-PAR-14.pdf (519702 bytes)
File Preparation: DUM-PAR-15.pdf (458158 bytes)
File Preparation: DUM-PAR-16.pdf (499607 bytes)
File Preparation: DUM-PAR-17.pdf (508523 bytes)
File Preparation: LBG-PAR-01.pdf (491058 bytes)
File Preparation: LBG-PAR-02.pdf (551861 bytes)
File Preparation: LBG-PAR-03.pdf (507001 bytes)
File Preparation: LBG-PAR-04.pdf (506422 bytes)
File Preparation: LBG-PAR-05.pdf (588666 bytes)
File Preparation: LBG-PAR-06.pdf (481501 bytes)
File Preparation: LBG-PAR-07.pdf (501962 bytes)
File Preparation: DUM-PAR-04.pdf (459255 bytes)
File Preparation: DUM-PAR-05.pdf (477370 bytes)
File Preparation: DUM-PAR-06.pdf (461131 bytes)

=== OCR Text Extraction Phase ===
OCR Extraction: DUM-PAR-01.pdf
  - Pages: 5
  - Extracted Text Length: 22072 characters
  - Status: Success
OCR Extraction: DUM-PAR-02.pdf
  - Pages: 5
  - Extracted Text Length: 22064 characters
  - Status: Success
OCR Extraction: DUM-PAR-03.pdf
  - Pages: 5
  - Extracted Text Length: 22545 characters
  - Status: Success
OCR Extraction: DUM-PAR-07.pdf
  - Pages: 5
  - Extracted Text Length: 22329 characters
  - Status: Success
OCR Extraction: DUM-PAR-08.pdf
  - Pages: 5
  - Extracted Text Length: 22833 characters
  - Status: Success
OCR Extraction: DUM-PAR-09.pdf
  - Pages: 5
  - Extracted Text Length: 22065 characters
  - Status: Success
OCR Extraction: DUM-PAR-10.pdf
  - Pages: 5
  - Extracted Text Length: 22539 characters
  - Status: Success
OCR Extraction: DUM-PAR-11.pdf
  - Pages: 5
  - Extracted Text Length: 22026 characters
  - Status: Success
OCR Extraction: DUM-PAR-12.pdf
  - Pages: 5
  - Extracted Text Length: 22340 characters
  - Status: Success
OCR Extraction: DUM-PAR-13.pdf
  - Pages: 5
  - Extracted Text Length: 22519 characters
  - Status: Success
OCR Extraction: DUM-PAR-14.pdf
  - Pages: 5
  - Extracted Text Length: 22369 characters
  - Status: Success
OCR Extraction: DUM-PAR-15.pdf
  - Pages: 5
  - Extracted Text Length: 22007 characters
  - Status: Success
OCR Extraction: DUM-PAR-16.pdf
  - Pages: 5
  - Extracted Text Length: 22065 characters
  - Status: Success
OCR Extraction: DUM-PAR-17.pdf
  - Pages: 5
  - Extracted Text Length: 22099 characters
  - Status: Success
OCR Extraction: LBG-PAR-01.pdf
  - Pages: 5
  - Extracted Text Length: 21996 characters
  - Status: Success
OCR Extraction: LBG-PAR-02.pdf
  - Pages: 5
  - Extracted Text Length: 22524 characters
  - Status: Success
OCR Extraction: LBG-PAR-03.pdf
  - Pages: 5
  - Extracted Text Length: 22268 characters
  - Status: Success
OCR Extraction: LBG-PAR-04.pdf
  - Pages: 5
  - Extracted Text Length: 22490 characters
  - Status: Success
OCR Extraction: LBG-PAR-05.pdf
  - Pages: 5
  - Extracted Text Length: 22836 characters
  - Status: Success
OCR Extraction: LBG-PAR-06.pdf
  - Pages: 5
  - Extracted Text Length: 22093 characters
  - Status: Success
OCR Extraction: LBG-PAR-07.pdf
  - Pages: 5
  - Extracted Text Length: 22481 characters
  - Status: Success
OCR Extraction: DUM-PAR-04.pdf
  - Pages: 5
  - Extracted Text Length: 22556 characters
  - Status: Success
OCR Extraction: DUM-PAR-05.pdf
  - Pages: 5
  - Extracted Text Length: 22319 characters
  - Status: Success
OCR Extraction: DUM-PAR-06.pdf
  - Pages: 5
  - Extracted Text Length: 22299 characters
  - Status: Success

=== LLM Analysis Phase ===
LLM Analysis: DUM-PAR-01.pdf
  - Tokens Used: 12104
  - Analysis Result: Success
  - VLM Remediation: Not Required
  - VLM Remediation: Not Required
  - VLM Remediation: Not Required
  - VLM Remediation: Not Required
LLM Analysis: DUM-PAR-02.pdf
  - Tokens Used: 11727
  - Analysis Result: Success
  - VLM Remediation: Not Required
  - VLM Remediation: Not Required
  - VLM Remediation: Not Required
  - VLM Remediation: Not Required
LLM Analysis: DUM-PAR-03.pdf
  - Tokens Used: 11796
  - Analysis Result: Success
  - VLM Remediation: Not Required
  - VLM Remediation: Not Required
  - VLM Remediation: Not Required
  - VLM Remediation: Not Required
LLM Analysis: DUM-PAR-07.pdf
  - Tokens Used: 11850
  - Analysis Result: Success
  - VLM Remediation: Not Required
  - VLM Remediation: Not Required
  - VLM Remediation: Not Required
  - VLM Remediation: Not Required
LLM Analysis: DUM-PAR-08.pdf
  - Tokens Used: 12274
  - Analysis Result: Success
  - VLM Remediation: Not Required
  - VLM Remediation: Not Required
  - VLM Remediation: Not Required
  - VLM Remediation: Not Required
LLM Analysis: DUM-PAR-09.pdf
  - Tokens Used: 11892
  - Analysis Result: Success
  - VLM Remediation: Not Required
  - VLM Remediation: Not Required
  - VLM Remediation: Not Required
  - VLM Remediation: Not Required
LLM Analysis: DUM-PAR-10.pdf
  - Tokens Used: 13295
  - Analysis Result: Success
  - VLM Remediation: Not Required
  - VLM Remediation: Not Required
  - VLM Remediation: Not Required
  - VLM Remediation: Not Required
LLM Analysis: DUM-PAR-11.pdf
  - Tokens Used: 13264
  - Analysis Result: Success
  - VLM Remediation: Not Required
  - VLM Remediation: Not Required
  - VLM Remediation: Not Required
  - VLM Remediation: Not Required
LLM Analysis: DUM-PAR-12.pdf
  - Tokens Used: 11900
  - Analysis Result: Success
  - VLM Remediation: Not Required
  - VLM Remediation: Not Required
  - VLM Remediation: Not Required
  - VLM Remediation: Not Required
LLM Analysis: DUM-PAR-13.pdf
  - Tokens Used: 11877
  - Analysis Result: Success
  - VLM Remediation: Not Required
  - VLM Remediation: Not Required
  - VLM Remediation: Not Required
  - VLM Remediation: Not Required
LLM Analysis: DUM-PAR-14.pdf
  - Tokens Used: 12333
  - Analysis Result: Success
  - VLM Remediation: Not Required
  - VLM Remediation: Not Required
  - VLM Remediation: Not Required
  - VLM Remediation: Not Required
LLM Analysis: DUM-PAR-15.pdf
  - Tokens Used: 12265
  - Analysis Result: Success
  - VLM Remediation: Not Required
  - VLM Remediation: Not Required
  - VLM Remediation: Not Required
  - VLM Remediation: Not Required
LLM Analysis: DUM-PAR-16.pdf
  - Tokens Used: 12300
  - Analysis Result: Success
  - VLM Remediation: Not Required
  - VLM Remediation: Not Required
  - VLM Remediation: Not Required
  - VLM Remediation: Not Required
LLM Analysis: DUM-PAR-17.pdf
  - Tokens Used: 12665
  - Analysis Result: Success
  - VLM Remediation: Not Required
  - VLM Remediation: Not Required
  - VLM Remediation: Not Required
  - VLM Remediation: Not Required
LLM Analysis: LBG-PAR-01.pdf
  - Tokens Used: 12728
  - Analysis Result: Success
  - VLM Remediation: Not Required
  - VLM Remediation: Not Required
  - VLM Remediation: Not Required
  - VLM Remediation: Not Required
LLM Analysis: LBG-PAR-02.pdf
  - Tokens Used: 12892
  - Analysis Result: Success
  - VLM Remediation: Not Required
  - VLM Remediation: Not Required
  - VLM Remediation: Not Required
LLM Analysis: LBG-PAR-03.pdf
  - Tokens Used: 12014
  - Analysis Result: Success
  - VLM Remediation: Not Required
  - VLM Remediation: Not Required
  - VLM Remediation: Not Required
  - VLM Remediation: Not Required
LLM Analysis: LBG-PAR-04.pdf
  - Tokens Used: 13903
  - Analysis Result: Success
  - VLM Remediation: Not Required
  - VLM Remediation: Not Required
  - VLM Remediation: Not Required
  - VLM Remediation: Not Required
LLM Analysis: LBG-PAR-05.pdf
  - Tokens Used: 12165
  - Analysis Result: Success
  - VLM Remediated Fields: 1 fields
  - VLM Tokens 使用: 1137
    * B/L split quantity (MT)=1,999.858
  - VLM Remediated Fields: 1 fields
  - VLM Tokens 使用: 991
    * B/L split quantity (MT)=1,999.858
  - VLM Remediated Fields: 1 fields
  - VLM Tokens 使用: 1151
    * B/L split quantity (MT)=1,999.858
  - VLM Remediated Fields: 1 fields
  - VLM Tokens 使用: 1128
    * B/L split quantity (MT)=1,999.858
LLM Analysis: LBG-PAR-06.pdf
  - Tokens Used: 12911
  - Analysis Result: Success
  - VLM Remediation: Not Required
  - VLM Remediation: Not Required
  - VLM Remediation: Not Required
  - VLM Remediation: Not Required
LLM Analysis: LBG-PAR-07.pdf
  - Tokens Used: 12549
  - Analysis Result: Success
  - VLM Remediation: Not Required
  - VLM Remediation: Not Required
  - VLM Remediation: Not Required
  - VLM Remediation: Not Required
LLM Analysis: DUM-PAR-04.pdf
  - Tokens Used: 11973
  - Analysis Result: Success
  - VLM Remediation: Not Required
  - VLM Remediation: Not Required
  - VLM Remediation: Not Required
  - VLM Remediation: Not Required
LLM Analysis: DUM-PAR-05.pdf
  - Tokens Used: 11889
  - Analysis Result: Success
  - VLM Remediation: Not Required
  - VLM Remediation: Not Required
  - VLM Remediation: Not Required
  - VLM Remediation: Not Required
LLM Analysis: DUM-PAR-06.pdf
  - Tokens Used: 11676
  - Analysis Result: Success
  - VLM Remediation: Not Required
  - VLM Remediation: Not Required
  - VLM Remediation: Not Required
  - VLM Remediation: Not Required

=== Processing Summary ===
Total Processing Time: 361.15 seconds
Total Tokens Used: 300649
Total Pages: 120
Successfully Processed Files: 24

=== Detailed File Processing Statistics ===
File: DUM-PAR-01.pdf
  - LLM Tokens: 12104
  - VLM Tokens: 0
  - Total Tokens: 12104
  - Successfully Extracted Fields: 16
  - Missing Fields: 0

File: DUM-PAR-02.pdf
  - LLM Tokens: 11727
  - VLM Tokens: 0
  - Total Tokens: 11727
  - Successfully Extracted Fields: 16
  - Missing Fields: 0

File: DUM-PAR-03.pdf
  - LLM Tokens: 11796
  - VLM Tokens: 0
  - Total Tokens: 11796
  - Successfully Extracted Fields: 16
  - Missing Fields: 0

File: DUM-PAR-07.pdf
  - LLM Tokens: 11850
  - VLM Tokens: 0
  - Total Tokens: 11850
  - Successfully Extracted Fields: 16
  - Missing Fields: 0

File: DUM-PAR-08.pdf
  - LLM Tokens: 12274
  - VLM Tokens: 0
  - Total Tokens: 12274
  - Successfully Extracted Fields: 16
  - Missing Fields: 0

File: DUM-PAR-09.pdf
  - LLM Tokens: 11892
  - VLM Tokens: 0
  - Total Tokens: 11892
  - Successfully Extracted Fields: 16
  - Missing Fields: 0

File: DUM-PAR-10.pdf
  - LLM Tokens: 13295
  - VLM Tokens: 0
  - Total Tokens: 13295
  - Successfully Extracted Fields: 16
  - Missing Fields: 0

File: DUM-PAR-11.pdf
  - LLM Tokens: 13264
  - VLM Tokens: 0
  - Total Tokens: 13264
  - Successfully Extracted Fields: 16
  - Missing Fields: 0

File: DUM-PAR-12.pdf
  - LLM Tokens: 11900
  - VLM Tokens: 0
  - Total Tokens: 11900
  - Successfully Extracted Fields: 16
  - Missing Fields: 0

File: DUM-PAR-13.pdf
  - LLM Tokens: 11877
  - VLM Tokens: 0
  - Total Tokens: 11877
  - Successfully Extracted Fields: 16
  - Missing Fields: 0

File: DUM-PAR-14.pdf
  - LLM Tokens: 12333
  - VLM Tokens: 0
  - Total Tokens: 12333
  - Successfully Extracted Fields: 16
  - Missing Fields: 0

File: DUM-PAR-15.pdf
  - LLM Tokens: 12265
  - VLM Tokens: 0
  - Total Tokens: 12265
  - Successfully Extracted Fields: 16
  - Missing Fields: 0

File: DUM-PAR-16.pdf
  - LLM Tokens: 12300
  - VLM Tokens: 0
  - Total Tokens: 12300
  - Successfully Extracted Fields: 16
  - Missing Fields: 0

File: DUM-PAR-17.pdf
  - LLM Tokens: 12665
  - VLM Tokens: 0
  - Total Tokens: 12665
  - Successfully Extracted Fields: 16
  - Missing Fields: 0

File: LBG-PAR-01.pdf
  - LLM Tokens: 12728
  - VLM Tokens: 0
  - Total Tokens: 12728
  - Successfully Extracted Fields: 16
  - Missing Fields: 0

File: LBG-PAR-02.pdf
  - LLM Tokens: 12892
  - VLM Tokens: 0
  - Total Tokens: 12892
  - Successfully Extracted Fields: 16
  - Missing Fields: 0

File: LBG-PAR-03.pdf
  - LLM Tokens: 12014
  - VLM Tokens: 0
  - Total Tokens: 12014
  - Successfully Extracted Fields: 16
  - Missing Fields: 0

File: LBG-PAR-04.pdf
  - LLM Tokens: 13903
  - VLM Tokens: 0
  - Total Tokens: 13903
  - Successfully Extracted Fields: 16
  - Missing Fields: 0

File: LBG-PAR-05.pdf
  - LLM Tokens: 12165
  - VLM Tokens: 1128
  - Total Tokens: 13293
  - Successfully Extracted Fields: 15
  - Missing Fields: 1
  - VLM Remediated Fields: B/L split quantity (MT)

File: LBG-PAR-06.pdf
  - LLM Tokens: 12911
  - VLM Tokens: 0
  - Total Tokens: 12911
  - Successfully Extracted Fields: 16
  - Missing Fields: 0

File: LBG-PAR-07.pdf
  - LLM Tokens: 12549
  - VLM Tokens: 0
  - Total Tokens: 12549
  - Successfully Extracted Fields: 16
  - Missing Fields: 0

File: DUM-PAR-04.pdf
  - LLM Tokens: 11973
  - VLM Tokens: 0
  - Total Tokens: 11973
  - Successfully Extracted Fields: 16
  - Missing Fields: 0

File: DUM-PAR-05.pdf
  - LLM Tokens: 11889
  - VLM Tokens: 0
  - Total Tokens: 11889
  - Successfully Extracted Fields: 16
  - Missing Fields: 0

File: DUM-PAR-06.pdf
  - LLM Tokens: 11676
  - VLM Tokens: 0
  - Total Tokens: 11676
  - Successfully Extracted Fields: 16
  - Missing Fields: 0

End Time: 2025-10-08 19:11:35
Output Excel: Cargo_BL_20251008_191134.xlsx
Output Log: Cargo_BL_20251008_191134_log.txt