=== File Analysis Processing Log ===
Start Time: 2025-10-08 19:31:17
Analysis Type: Cargo_BL
Language: en
File Count: 23
Custom Prompt: No

File Preparation: DUM-PAR-01.pdf (446819 bytes)
File Preparation: DUM-PAR-02.pdf (455510 bytes)
File Preparation: DUM-PAR-03.pdf (463161 bytes)
File Preparation: DUM-PAR-07.pdf (451270 bytes)
File Preparation: DUM-PAR-08.pdf (480078 bytes)
File Preparation: DUM-PAR-09.pdf (486893 bytes)
File Preparation: DUM-PAR-10.pdf (498668 bytes)
File Preparation: DUM-PAR-11.pdf (473492 bytes)
File Preparation: DUM-PAR-12.pdf (455205 bytes)
File Preparation: DUM-PAR-13.pdf (479730 bytes)
File Preparation: DUM-PAR-14.pdf (519702 bytes)
File Preparation: DUM-PAR-15.pdf (458158 bytes)
File Preparation: DUM-PAR-16.pdf (499607 bytes)
File Preparation: DUM-PAR-17.pdf (508523 bytes)
File Preparation: LBG-PAR-01.pdf (491058 bytes)
File Preparation: LBG-PAR-02.pdf (551861 bytes)
File Preparation: LBG-PAR-03.pdf (507001 bytes)
File Preparation: LBG-PAR-04.pdf (506422 bytes)
File Preparation: LBG-PAR-06.pdf (481501 bytes)
File Preparation: LBG-PAR-07.pdf (501962 bytes)
File Preparation: DUM-PAR-04.pdf (459255 bytes)
File Preparation: DUM-PAR-05.pdf (477370 bytes)
File Preparation: DUM-PAR-06.pdf (461131 bytes)

=== OCR Text Extraction Phase ===
OCR Extraction: DUM-PAR-01.pdf
  - Pages: 5
  - Extracted Text Length: 22072 characters
  - Status: Success
OCR Extraction: DUM-PAR-02.pdf
  - Pages: 5
  - Extracted Text Length: 22064 characters
  - Status: Success
OCR Extraction: DUM-PAR-03.pdf
  - Pages: 5
  - Extracted Text Length: 22545 characters
  - Status: Success
OCR Extraction: DUM-PAR-07.pdf
  - Pages: 5
  - Extracted Text Length: 22329 characters
  - Status: Success
OCR Extraction: DUM-PAR-08.pdf
  - Pages: 5
  - Extracted Text Length: 22833 characters
  - Status: Success
OCR Extraction: DUM-PAR-09.pdf
  - Pages: 5
  - Extracted Text Length: 22065 characters
  - Status: Success
OCR Extraction: DUM-PAR-10.pdf
  - Pages: 5
  - Extracted Text Length: 22539 characters
  - Status: Success
OCR Extraction: DUM-PAR-11.pdf
  - Pages: 5
  - Extracted Text Length: 22026 characters
  - Status: Success
OCR Extraction: DUM-PAR-12.pdf
  - Pages: 5
  - Extracted Text Length: 22340 characters
  - Status: Success
OCR Extraction: DUM-PAR-13.pdf
  - Pages: 5
  - Extracted Text Length: 22519 characters
  - Status: Success
OCR Extraction: DUM-PAR-14.pdf
  - Pages: 5
  - Extracted Text Length: 22369 characters
  - Status: Success
OCR Extraction: DUM-PAR-15.pdf
  - Pages: 5
  - Extracted Text Length: 22007 characters
  - Status: Success
OCR Extraction: DUM-PAR-16.pdf
  - Pages: 5
  - Extracted Text Length: 22065 characters
  - Status: Success
OCR Extraction: DUM-PAR-17.pdf
  - Pages: 5
  - Extracted Text Length: 22099 characters
  - Status: Success
OCR Extraction: LBG-PAR-01.pdf
  - Pages: 5
  - Extracted Text Length: 21996 characters
  - Status: Success
OCR Extraction: LBG-PAR-02.pdf
  - Pages: 5
  - Extracted Text Length: 22524 characters
  - Status: Success
OCR Extraction: LBG-PAR-03.pdf
  - Pages: 5
  - Extracted Text Length: 22268 characters
  - Status: Success
OCR Extraction: LBG-PAR-04.pdf
  - Pages: 5
  - Extracted Text Length: 22490 characters
  - Status: Success
OCR Extraction: LBG-PAR-06.pdf
  - Pages: 5
  - Extracted Text Length: 22093 characters
  - Status: Success
OCR Extraction: LBG-PAR-07.pdf
  - Pages: 5
  - Extracted Text Length: 22481 characters
  - Status: Success
OCR Extraction: DUM-PAR-04.pdf
  - Pages: 5
  - Extracted Text Length: 22556 characters
  - Status: Success
OCR Extraction: DUM-PAR-05.pdf
  - Pages: 5
  - Extracted Text Length: 22319 characters
  - Status: Success
OCR Extraction: DUM-PAR-06.pdf
  - Pages: 5
  - Extracted Text Length: 22299 characters
  - Status: Success

=== LLM Analysis Phase ===
LLM Analysis: DUM-PAR-01.pdf
  - Tokens Used: 11782
  - Analysis Result: Success
  - VLM Remediation: Not Required
  - VLM Remediation: Not Required
  - VLM Remediation: Not Required
  - VLM Remediation: Not Required
LLM Analysis: DUM-PAR-02.pdf
  - Tokens Used: 11816
  - Analysis Result: Success
  - VLM Remediation: Not Required
  - VLM Remediation: Not Required
  - VLM Remediation: Not Required
  - VLM Remediation: Not Required
LLM Analysis: DUM-PAR-03.pdf
  - Tokens Used: 11918
  - Analysis Result: Success
  - VLM Remediation: Not Required
  - VLM Remediation: Not Required
  - VLM Remediation: Not Required
  - VLM Remediation: Not Required
LLM Analysis: DUM-PAR-07.pdf
  - Tokens Used: 11743
  - Analysis Result: Success
  - VLM Remediation: Not Required
  - VLM Remediation: Not Required
  - VLM Remediation: Not Required
  - VLM Remediation: Not Required
LLM Analysis: DUM-PAR-08.pdf
  - Tokens Used: 12258
  - Analysis Result: Success
  - VLM Remediation: Not Required
  - VLM Remediation: Not Required
  - VLM Remediation: Not Required
  - VLM Remediation: Not Required
LLM Analysis: DUM-PAR-09.pdf
  - Tokens Used: 11853
  - Analysis Result: Success
  - VLM Remediation: Not Required
  - VLM Remediation: Not Required
  - VLM Remediation: Not Required
  - VLM Remediation: Not Required
LLM Analysis: DUM-PAR-10.pdf
  - Tokens Used: 12451
  - Analysis Result: Success
  - VLM Remediation: Not Required
  - VLM Remediation: Not Required
  - VLM Remediation: Not Required
  - VLM Remediation: Not Required
LLM Analysis: DUM-PAR-11.pdf
  - Tokens Used: 14121
  - Analysis Result: Success
  - VLM Remediation: Not Required
  - VLM Remediated Fields: 1 fields
  - VLM Tokens 使用: 975
    * OBL release date=2025-07-20
  - VLM Remediated Fields: 1 fields
  - VLM Tokens 使用: 966
    * OBL release date=2025-07-20
  - VLM Remediated Fields: 1 fields
  - VLM Tokens 使用: 966
    * OBL release date=2025-07-20
LLM Analysis: DUM-PAR-12.pdf
  - Tokens Used: 11905
  - Analysis Result: Success
  - VLM Remediation: Not Required
  - VLM Remediation: Not Required
  - VLM Remediation: Not Required
  - VLM Remediation: Not Required
LLM Analysis: DUM-PAR-13.pdf
  - Tokens Used: 12555
  - Analysis Result: Success
  - VLM Remediation: Not Required
  - VLM Remediation: Not Required
  - VLM Remediation: Not Required
  - VLM Remediation: Not Required
LLM Analysis: DUM-PAR-14.pdf
  - Tokens Used: 12661
  - Analysis Result: Success
  - VLM Remediation: Not Required
  - VLM Remediation: Not Required
  - VLM Remediation: Not Required
  - VLM Remediation: Not Required
LLM Analysis: DUM-PAR-15.pdf
  - Tokens Used: 11473
  - Analysis Result: Success
  - VLM Remediation: Not Required
  - VLM Remediation: Not Required
  - VLM Remediation: Not Required
  - VLM Remediation: Not Required
LLM Analysis: DUM-PAR-16.pdf
  - Tokens Used: 12339
  - Analysis Result: Success
  - VLM Remediation: Not Required
  - VLM Remediation: Not Required
  - VLM Remediation: Not Required
  - VLM Remediation: Not Required
LLM Analysis: DUM-PAR-17.pdf
  - Tokens Used: 12406
  - Analysis Result: Success
  - VLM Remediation: Not Required
  - VLM Remediation: Not Required
  - VLM Remediation: Not Required
  - VLM Remediation: Not Required
LLM Analysis: LBG-PAR-01.pdf
  - Tokens Used: 12688
  - Analysis Result: Success
  - VLM Remediation: Not Required
  - VLM Remediation: Not Required
  - VLM Remediation: Not Required
  - VLM Remediation: Not Required
LLM Analysis: LBG-PAR-02.pdf
  - Tokens Used: 14533
  - Analysis Result: Success
  - VLM Remediation: Not Required
  - VLM Remediation: Not Required
  - VLM Remediation: Not Required
  - VLM Remediation: Not Required
LLM Analysis: LBG-PAR-03.pdf
  - Tokens Used: 11778
  - Analysis Result: Success
  - VLM Remediation: Not Required
  - VLM Remediation: Not Required
  - VLM Remediation: Not Required
  - VLM Remediation: Not Required
LLM Analysis: LBG-PAR-04.pdf
  - Tokens Used: 13477
  - Analysis Result: Success
  - VLM Remediation: Not Required
  - VLM Remediation: Not Required
  - VLM Remediation: Not Required
  - VLM Remediation: Not Required
LLM Analysis: LBG-PAR-06.pdf
  - Tokens Used: 13742
  - Analysis Result: Success
  - VLM Remediation: Not Required
  - VLM Remediation: Not Required
  - VLM Remediation: Not Required
  - VLM Remediation: Not Required
LLM Analysis: LBG-PAR-07.pdf
  - Tokens Used: 12539
  - Analysis Result: Success
  - VLM Remediation: Not Required
  - VLM Remediation: Not Required
  - VLM Remediation: Not Required
  - VLM Remediation: Not Required
LLM Analysis: DUM-PAR-04.pdf
  - Tokens Used: 11542
  - Analysis Result: Success
  - VLM Remediation: Not Required
  - VLM Remediation: Not Required
  - VLM Remediation: Not Required
  - VLM Remediation: Not Required
LLM Analysis: DUM-PAR-05.pdf
  - Tokens Used: 12505
  - Analysis Result: Success
  - VLM Remediation: Not Required
  - VLM Remediation: Not Required
  - VLM Remediation: Not Required
  - VLM Remediation: Not Required
LLM Analysis: DUM-PAR-06.pdf
  - Tokens Used: 12516
  - Analysis Result: Success
  - VLM Remediation: Not Required
  - VLM Remediation: Not Required
  - VLM Remediation: Not Required
  - VLM Remediation: Not Required

=== Processing Summary ===
Total Processing Time: 393.29 seconds
Total Tokens Used: 289508
Total Pages: 115
Successfully Processed Files: 23

=== Detailed File Processing Statistics ===
File: DUM-PAR-01.pdf
  - LLM Tokens: 11782
  - VLM Tokens: 0
  - Total Tokens: 11782
  - Successfully Extracted Fields: 16
  - Missing Fields: 0

File: DUM-PAR-02.pdf
  - LLM Tokens: 11816
  - VLM Tokens: 0
  - Total Tokens: 11816
  - Successfully Extracted Fields: 16
  - Missing Fields: 0

File: DUM-PAR-03.pdf
  - LLM Tokens: 11918
  - VLM Tokens: 0
  - Total Tokens: 11918
  - Successfully Extracted Fields: 16
  - Missing Fields: 0

File: DUM-PAR-07.pdf
  - LLM Tokens: 11743
  - VLM Tokens: 0
  - Total Tokens: 11743
  - Successfully Extracted Fields: 16
  - Missing Fields: 0

File: DUM-PAR-08.pdf
  - LLM Tokens: 12258
  - VLM Tokens: 0
  - Total Tokens: 12258
  - Successfully Extracted Fields: 16
  - Missing Fields: 0

File: DUM-PAR-09.pdf
  - LLM Tokens: 11853
  - VLM Tokens: 0
  - Total Tokens: 11853
  - Successfully Extracted Fields: 16
  - Missing Fields: 0

File: DUM-PAR-10.pdf
  - LLM Tokens: 12451
  - VLM Tokens: 0
  - Total Tokens: 12451
  - Successfully Extracted Fields: 16
  - Missing Fields: 0

File: DUM-PAR-11.pdf
  - LLM Tokens: 14121
  - VLM Tokens: 966
  - Total Tokens: 15087
  - Successfully Extracted Fields: 15
  - Missing Fields: 1
  - VLM Remediated Fields: OBL release date

File: DUM-PAR-12.pdf
  - LLM Tokens: 11905
  - VLM Tokens: 0
  - Total Tokens: 11905
  - Successfully Extracted Fields: 16
  - Missing Fields: 0

File: DUM-PAR-13.pdf
  - LLM Tokens: 12555
  - VLM Tokens: 0
  - Total Tokens: 12555
  - Successfully Extracted Fields: 16
  - Missing Fields: 0

File: DUM-PAR-14.pdf
  - LLM Tokens: 12661
  - VLM Tokens: 0
  - Total Tokens: 12661
  - Successfully Extracted Fields: 16
  - Missing Fields: 0

File: DUM-PAR-15.pdf
  - LLM Tokens: 11473
  - VLM Tokens: 0
  - Total Tokens: 11473
  - Successfully Extracted Fields: 16
  - Missing Fields: 0

File: DUM-PAR-16.pdf
  - LLM Tokens: 12339
  - VLM Tokens: 0
  - Total Tokens: 12339
  - Successfully Extracted Fields: 16
  - Missing Fields: 0

File: DUM-PAR-17.pdf
  - LLM Tokens: 12406
  - VLM Tokens: 0
  - Total Tokens: 12406
  - Successfully Extracted Fields: 16
  - Missing Fields: 0

File: LBG-PAR-01.pdf
  - LLM Tokens: 12688
  - VLM Tokens: 0
  - Total Tokens: 12688
  - Successfully Extracted Fields: 16
  - Missing Fields: 0

File: LBG-PAR-02.pdf
  - LLM Tokens: 14533
  - VLM Tokens: 0
  - Total Tokens: 14533
  - Successfully Extracted Fields: 16
  - Missing Fields: 0

File: LBG-PAR-03.pdf
  - LLM Tokens: 11778
  - VLM Tokens: 0
  - Total Tokens: 11778
  - Successfully Extracted Fields: 16
  - Missing Fields: 0

File: LBG-PAR-04.pdf
  - LLM Tokens: 13477
  - VLM Tokens: 0
  - Total Tokens: 13477
  - Successfully Extracted Fields: 16
  - Missing Fields: 0

File: LBG-PAR-06.pdf
  - LLM Tokens: 13742
  - VLM Tokens: 0
  - Total Tokens: 13742
  - Successfully Extracted Fields: 16
  - Missing Fields: 0

File: LBG-PAR-07.pdf
  - LLM Tokens: 12539
  - VLM Tokens: 0
  - Total Tokens: 12539
  - Successfully Extracted Fields: 16
  - Missing Fields: 0

File: DUM-PAR-04.pdf
  - LLM Tokens: 11542
  - VLM Tokens: 0
  - Total Tokens: 11542
  - Successfully Extracted Fields: 16
  - Missing Fields: 0

File: DUM-PAR-05.pdf
  - LLM Tokens: 12505
  - VLM Tokens: 0
  - Total Tokens: 12505
  - Successfully Extracted Fields: 16
  - Missing Fields: 0

File: DUM-PAR-06.pdf
  - LLM Tokens: 12516
  - VLM Tokens: 0
  - Total Tokens: 12516
  - Successfully Extracted Fields: 16
  - Missing Fields: 0

End Time: 2025-10-08 19:37:50
Output Excel: Cargo_BL_20251008_193750.xlsx
Output Log: Cargo_BL_20251008_193750_log.txt